Fortiva-91-Yun-et-al.-2014-A-robotic-treatment-approach-to-promote-social-int.pdf,A Robotic Treatment Approach to promote Social Interaction Skills for Children with Autism Spectrum Disorders,Yun; S. S.; Park; S. K.; & Choi; J. (2014). A robotic treatment approach to promote social interaction skills for children with autism spectrum disorders. In Proceedings of the IEEE International Conference on Robotics and Automation (ICRA).,(Yun et al.; 2014),N/A. The study did not aim at studying children with other neurodevelopmental disabilities.
Fortiva-92-Yun-et-al.-2016-Robotic-behavioral-intervention-to-facilitate-eye.pdf,Robotic Behavioral Intervention to Facilitate Eye Contact and Reading Emotions of Children with Autism Spectrum Disorders,Yun; S. S.; Choi; J.; & Park; S. K. (2016). Robotic behavioral intervention to facilitate eye contact and reading emotions of children with autism spectrum disorders. IFAC-PapersOnLine; 49(19); 581-586.,(Yun et al.; 2016),N/A. The study only included children with ASD and did not include children with other neurodevelopmental disabilities.
Fortiva-93-Zamin-2019-Jawi-Alphabot-A-Jawi-Teaching-Robot-for-Children.pdf,Jawi Alphabot: A Jawi Teaching Robot for Children with Autism,Zamin; N.; Norwawi; N. M.; Arshad; N. I.; & Ismail; M. A. A. (2019). Jawi Alphabot: A Jawi Teaching Robot for Children with Autism. International Journal of Advanced Trends in Computer Science and Engineering; 8(1.4); 93-98. https://doi.org/10.30534/ijatcse/2019/5581.42019,(Zamin et al.; 2019),N/A. The study focused specifically on children with ASD; not other neurodevelopmental disabilities.
Fortiva-94-Zanatta-et-al.-2023-Combining-robot-assisted-therapy-with-virtual-real.pdf.pdf,Combining robot-assisted therapy with virtual reality or using it alone? A systematic review on health-related quality of life in neurological patients,Zanatta; F.; Farhane-Medina; N. Z.; Adorni; R.; Steca; P.; Giardini; A.; D'Addario; M.; & Pierobon; A. (2023). Combining robot-assisted therapy with virtual reality or using it alone? A systematic review on health-related quality of life in neurological patients. Health and Quality of Life Outcomes; 21(1); 18.,(Zanatta et al.; 2023),N/A. The study did not aim to study children with other neurodevelopmental disabilities. It was a systematic review on the effects of robot-assisted therapy and virtual reality on health-related quality of life in neurological patients.
Fortiva-95-Zhanatkyzy-et-al.-2020-Quantitative-Results-of-Robot-Assisted-Therapy-for.pdf,Quantitative Results of Robot-Assisted Therapy for Children with Autism; ADHD and Delayed Speech Development,Zhanatkyzy; A.; Telisheva; Z.; Turarova; A.; Zhexenova; Z.; & Sandygulova; A. (2020). Quantitative Results of Robot-Assisted Therapy for Children with Autism; ADHD and Delayed Speech Development. In Companion of the 2020 ACM/IEEE International Conference on Human-Robot Interaction (HRI '20 Companion); March 23-26; 2020; Cambridge; United Kingdom. ACM; New York; NY; USA; 2 pages. https://doi.org/10.1145/3371382.3378254,(Zhanatkyzy et al.; 2020),Yes. The paper studies children with ADHD and Delayed Speech Development (DSD) in addition to ASD.
Fortiva-96-Simlesa-et-al.-2022-Imitation-focus-of-attention-and-social-behaviour.pdf,Imitation; focus of attention and social behaviours of children with autism spectrum disorder in interaction with robots,Šimleša; S.; Stošić; J.; Bilić; I.; & Cepanec; M. (2022). Imitation; focus of attention and social behaviours of children with autism spectrum disorder in interaction with robots. Interaction Studies; 1-20.,(Šimleša et al.; 2022),Yes; the study included a control group of 12 typically developing (TD) children without ASD or other medical conditions.
